{
  "$schema": "https://json-schema.org/draft/2020-12/schema",
  "$id": "https://boglim1984.github.io/orion-ttd-mobile-extension/tools/command-language-casework/schema/casework-suite.schema.json",
  "title": "Command Language Casework Suite",
  "type": "object",
  "required": [
    "suite_id",
    "suite_title",
    "suite_goal",
    "route_id",
    "run_config",
    "cases"
  ],
  "properties": {
    "suite_id": {
      "type": "string"
    },
    "suite_title": {
      "type": "string"
    },
    "suite_goal": {
      "type": "string"
    },
    "created_for_tool": {
      "type": "string",
      "description": "Preferred value: command-language-casework-runner-v1. Treated as descriptive metadata by the validator."
    },
    "route_id": {
      "type": "string"
    },
    "route_fixture": {
      "type": "string"
    },
    "notes": {
      "type": "string"
    },
    "run_config": {
      "type": "object",
      "description": "Executable runner config. Keep research metadata out of this object.",
      "required": [
        "send_mode",
        "turn_timeout_ms",
        "stability_wait_ms"
      ],
      "properties": {
        "target_chat": {
          "const": "visible_current_chatgpt_page",
          "description": "Optional local-runner target hint. The validator does not require it."
        },
        "send_mode": {
          "const": "explicit_casework_run_button",
          "description": "Required exact value."
        },
        "turn_timeout_ms": {
          "type": "number",
          "description": "Required finite number."
        },
        "stability_wait_ms": {
          "type": "number",
          "description": "Required finite number."
        },
        "stop_on_case_failure": {
          "type": "boolean"
        },
        "stop_after_each_case": {
          "type": "boolean"
        }
      },
      "additionalProperties": true
    },
    "cases": {
      "type": "array",
      "minItems": 1,
      "items": {
        "type": "object",
        "required": [
          "case_id",
          "title",
          "research_question",
          "packet",
          "scripted_user_replies",
          "expected_behavior",
          "forbidden_behavior",
          "expected_reducer_semantics",
          "classification_targets"
        ],
        "properties": {
          "case_id": {
            "type": "string"
          },
          "title": {
            "type": "string"
          },
          "research_question": {
            "type": "string"
          },
          "language_feature": {
            "type": "string"
          },
          "packet": {
            "type": "string",
            "minLength": 1,
            "description": "Must be a non-empty string, usually beginning with TTD_COMMAND_V1\\n followed by the packet JSON/text body. Never use a nested object here. If embedding JSON packet content inside this string, escape the inner quotes so the outer suite remains valid JSON."
          },
          "scripted_user_replies": {
            "type": "array",
            "items": {
              "type": "string"
            }
          },
          "expected_behavior": {
            "type": "array",
            "items": {
              "type": "string"
            }
          },
          "forbidden_behavior": {
            "type": "array",
            "items": {
              "type": "string"
            }
          },
          "expected_reducer_semantics": {
            "type": "string",
            "minLength": 1
          },
          "classification_targets": {
            "type": "array",
            "items": {
              "type": "string"
            }
          },
          "stop_after_turns": {
            "type": "number"
          },
          "notes": {
            "type": "string"
          }
        },
        "additionalProperties": true
      }
    }
  },
  "additionalProperties": true
}
